{
  "$schema": "item@2",
  "id": "srd51.item.healers_kit",
  "name": "Healer's Kit",
  "source": {
    "ref": "SRD 5.1",
    "license": "CC-BY-4.0"
  },
  "category": "gear",
  "cost_cp": 500,
  "weight_oz": 48,
  "description": "This kit is a leather pouch containing bandages, salves, and splints. The kit has ten uses. As an action, you can expend one use of the kit to stabilize a creature that has 0 hit points, without needing to make a Wisdom (Medicine) check."
}
