{
  "$schema": "item@2",
  "id": "srd51.item.rations_1_day",
  "name": "Rations (1 day)",
  "source": {
    "ref": "SRD 5.1",
    "license": "CC-BY-4.0"
  },
  "category": "gear",
  "cost_cp": 50,
  "weight_oz": 32,
  "description": "Rations consist of dry foods suitable for extended travel, including jerky, dried fruit, hardtack, and nuts."
}
